{
  "schemaVersion": "1.0.0",
  "gravityMps2": 9.81,
  "airDensityMode": "StandardAtmosphere",
  "airDensityKgM3": 1.225,
  "windMode": "Turbulence",
  "windVelocityWorldMps": [
    2,
    0,
    0
  ],
  "gustEnabled": true,
  "altitudeM": 0,
  "temperatureK": 253.15,
  "pressurePa": 101325,
  "gustIntensityMps": 0.4,
  "gustTimeScaleS": 3,
  "turbulenceSeed": 48271,
  "weather": {
    "precipitation": "Snow",
    "intensityMmPerHour": 2,
    "model": "VisualOnly"
  }
}
