{
  "schemaVersion": "1.0.0",
  "gravityMps2": 9.81,
  "airDensityMode": "StandardAtmosphere",
  "airDensityKgM3": 1.225,
  "windMode": "DrydenFrozen",
  "windVelocityWorldMps": [
    5,
    0,
    0
  ],
  "gustEnabled": false,
  "altitudeM": 0,
  "temperatureK": 288.15,
  "pressurePa": 101325,
  "gustIntensityMps": 0.4,
  "gustTimeScaleS": 3,
  "turbulenceSeed": 48271,
  "dryden": {
    "sigmaUvwMps": [
      0.4,
      0.4,
      0.25
    ],
    "lengthScaleUvwM": [
      20,
      20,
      10
    ],
    "advectionDirectionWorld": [
      1,
      0,
      0
    ],
    "advectionSpeedMps": 5,
    "modesPerComponent": 32,
    "minDimensionlessWaveNumber": 0.02,
    "maxDimensionlessWaveNumber": 20
  }
}
